gemlite_config_2_gemv_splitk_gemm_splitk.json
{"GEMV": {}, "GEMV_REVSPLITK": {}, "GEMV_SPLITK": {"(1, 4096, 4096, 128, 16)": {"BLOCK_SIZE_M": 1, "BLOCK_SIZE_N": 16, "BLOCK_SIZE_K": 128, "GROUP_SIZE_M": 8, "SPLIT_K": 1, "A_load_order": 0, "meta_evict_policy": "", "atomic_mode": "relaxed", "dot_prod_mode": 0, "num_warps": 8, "num_ctas": 1, "num_stages": 1}, "(1, 11008, 4096, 128, 16)": {"BLOCK_SIZE_M": 1, "BLOCK_SIZE_N": 32, "BLOCK_SIZE_K": 128, "GROUP_SIZE_M": 8, "SPLIT_K": 1, "A_load_order": 0, "meta_evict_policy": "", "atomic_mode": "relaxed", "dot_prod_mode": 0, "num_warps": 8, "num_ctas": 1, "num_stages": 1}, "(1, 4096, 11008, 128, 16)": {"BLOCK_SIZE_M": 1, "BLOCK_SIZE_N": 4, "BLOCK_SIZE_K": 128, "GROUP_SIZE_M": 8, "SPLIT_K": 1, "A_load_order": 0, "meta_evict_policy": "", "atomic_mode": "relaxed", "dot_prod_mode": 0, "num_warps": 4, "num_ctas": 1, "num_stages": 2}}, "GEMM_SPLITK": {"(64, 4096, 4096, 128, 16)": {"BLOCK_SIZE_M": 32, "BLOCK_SIZE_N": 64, "BLOCK_SIZE_K": 64, "GROUP_SIZE_M": 8, "SPLIT_K": 4, "A_load_order": 2, "meta_evict_policy": "", "atomic_mode": "relaxed", "num_warps": 8, "num_ctas": 1, "num_stages": 1}, "(64, 11008, 4096, 128, 16)": {"BLOCK_SIZE_M": 32, "BLOCK_SIZE_N": 64, "BLOCK_SIZE_K": 128, "GROUP_SIZE_M": 8, "SPLIT_K": 1, "A_load_order": 0, "meta_evict_policy": "", "atomic_mode": "relaxed", "num_warps": 4, "num_ctas": 1, "num_stages": 1}, "(64, 4096, 11008, 128, 16)": {"BLOCK_SIZE_M": 32, "BLOCK_SIZE_N": 64, "BLOCK_SIZE_K": 64, "GROUP_SIZE_M": 8, "SPLIT_K": 4, "A_load_order": 2, "meta_evict_policy": "", "atomic_mode": "relaxed", "num_warps": 4, "num_ctas": 1, "num_stages": 1}}, "GEMM": {}}